{
  "finding_id": "manual:TRACE-FIXTURE-001",
  "fingerprints": {
    "fixture/v1": "trace-fixture-001"
  },
  "keywords": [
    "containment",
    "escape",
    "member",
    "name"
  ],
  "locations": [
    {
      "path": "src/archive.sh",
      "region": {
        "end_column": 1,
        "end_line": 8,
        "start_column": 1,
        "start_line": 4
      },
      "symbol": "unsafe_join"
    }
  ],
  "message": {
    "text": "unsafe_join accepts a parent-directory member name without containment validation.",
    "title": "Archive member path can escape the extraction root"
  },
  "rule": {
    "cwes": [
      "CWE-22"
    ],
    "id": "SKYLARK-PATH-TRAVERSAL",
    "name": "Unsafe archive path join",
    "tags": [
      "archive",
      "path-traversal"
    ]
  },
  "schema_version": "normalized-finding-v1",
  "severity": {
    "normalized": "HIGH",
    "original": "high"
  },
  "source": {
    "input_sha256": "sha256:29f57954debacb2631d72efe46a68d39a2993d0dd5e167567c59fe5921e8f6a6",
    "kind": "MANUAL"
  }
}
